id,Question,optionA,optionB,optionC,optionD,correct_option,Time,Explanation
994,Which aviation company got world's top Airline stock in 2017 with 124% Gain?,Sahara,Air Asia,SpiceJet,Jet Airways,C,45,"SpiceJet is world's top Airline stock in 2017 with 124% gain. SpiceJet Limited forced to ground its entire fleet on its inability to pay $2.2 million in fuel bills, the budget airline becomes the world's best-performing airline stock with $26 billion."
995,USA declare this country among the World's Worst offenders on human trafficking in its annual Trafficking in Persons Report.,China,Japan,Russia,Isreal,A,45,"United States of America (USA) is set to declare China as one among the World's Worst offenders on human trafficking in its annual Trafficking in Persons Report. The declaration would place China in the same category as North Korea, Zimbabwe, and Syria."
996,Who is appointed as ambassador for Government's Skill India campaign?,Aishwarya Rai,Deepika Padukone,Anushka Sharma,Priyanka Chopra,D,45,"Actress Priyanka Chopra will soon be seen endorsing government's flagship Skill India campaign, with the National Skill Development Corporation roping in the Bollywood celebrity as an ambassador for the initiative. The Skill India campaign was launched by Prime Minister Modi in July 2015."
997,Which feature opportunity did Mars Rover finds evidence recently?,Ancient Planet,Ancient Lake,Ancient satellite,Ancient Eroded Valley,B,45,NASA's Opportunity Mars rover is examining the edge of a crater on the red planet that may once have been a lake of liquid water. It found rocks at the edge of Endeavour Crater that were either transported by a flood or eroded in place by wind. The Opportunity mission has been investigating sites on and near the western rim of Endeavour Crater since 2011.
998,Which Indian shooter has bagged gold in the Women's 10m Air Pistol at the ISSF Junior World Rifle/Pistol Championship?,Nandini SIngh,Anjali Bhagwat,Yashaswini Singh Deswal,Apurvi Chandela,C,45,Pistol shooter Yashaswini Singh Deswal put up a bright performance to bag a gold in the 10m Air Pistol Women in Germany. She bagged the gold in the ISSF Junior World Championship which is being held in Germany. She fired 235.9 points to clinch the gold.
999,Which system is employed in the civilians in peace stations?,Sahayak system,Missile systems,Tactical Communications System,Combat systems,A,45,"Indian Army is actively now considering the recruiting civilian staff in peace stations with the colonial-era Sahayak system. Sahayaks are soldiers and their duties include protecting the officers, maintaining their weapons and equipment and also helping them in carrying out their responsibilities."
1000,Who has won the 2017 Sahitya Academy Yuva Puraskar in English Language?,Ram Mori,Pratim Baruah,Manu S Pillai,Shamik Ghosh,C,45,"Manu S Pillai has won the 2017 Sahitya Academy Yuva Puraskar in English Language for his book titled ""The Ivory Throne - Chronicles of the House of Travancore"", the biography of the last queen of Travancore. The book unfolds the rise and fall of Maharani Sethu Lakshmi Bai, who ruled Travancore between 1924 -193. The book discusses the unheard life and rare customs of the royal family."
1001,The World Bank (WB) has sanctioned how much amount of loan assistance for the Assam State Public Finance Institutional Reforms (ASPIRe) Project?,$54 million,$44 million,$64 million,$84 million,B,45,"The World Bank (WB) has approved a loan assistance of $44 million for the Assam State Public Finance Institutional Reforms (ASPIRe) Project. The ASPIRe project is based on three important components that act as pillars for institutional reforms - strengthening public finance institutional capacity, strengthening expenditure and revenue information systems and on project management, monitoring and evaluation, and coordination. The purpose of the project is to improve predictability and transparency in budget execution and efficiency in tax administration in Assam."
1002,Who has been appointed the head of the reconstituted Oversight Committee (OC) of RBI for faster bad loan resolution?,Pradeep Kumar,Janki Ballabh,M.B.N. Rao,Y.M. Deosthalee,A,45,"The Reserve Bank of India (RBI) has recently expanded the Oversight Committee (OC) from 2 to 5 for faster bad loan resolution in the banking sector. The three new members are M.B.N. Rao, Y.M. Deosthalee and S. Raman. According to the reconstituted structure, the 5-member OC will be led by a chairman and work through multiple benches to approve various cases of restructuring referred by banks."
1003,Which Indian state hosted the 2017 International Federation of Sport Climbing (IFSC) World Cup?,Assam,Uttar Pradesh,Gujarat,Maharashtra,D,45,"The 6th edition of International Federation of Sport Climbing (IFSC) World Cup was held at the CIDCO Exhibition Centre in Navi Mumbai, Maharashtra on June 24 - 25, 2017. Over 150 athletes from across the globe will participate at the World Cup including the top talent from India."
1004,Who is honoured with the United Nations Public Service Award?,Shri Raman Singh,Smt Mamata Banerjee,Shri Arvind Kejriwal,Shri Raj Singh,B,45,"West Bengal Chief Minister Mamata Banerjee received the highest prize in United Nations Public Service Award for the State Government's Kanyashree Prakalpa (Girl Child) scheme in The Hague, Netherlands."
1005,Who is appointed as the ICC Deputy chairman?,Imran Khawaja,Kailash Raj,Suresh Sinha,Akbar Singh,A,45,Imran Khawaja appointed as International Cricket Council (ICC) as Deputy Chairman. He is a senior lawyer and serving in the ICC Board for several years.
1006,Who launched the Passport Seva Project (PSP) in India?,Shri D V Sadananda Gowda,Shri Manoj Sinha,Shri Ravi Shankar Prasad,Shri Radha Mohan Singh,B,45,The Minister for Communications Shri Manoj Sinha launched Passport Seva Project (PSP) in India with its successful implementation in the Public Private Partnership (PPP) mode. The Passports Act provides issue of passports and travel documents and regulation of the departure from India of Indian citizens.
1007,Which city has been chosen for Council of Scientific & Industrial Research (CSIR) by the NITI AAyog team recently?,Chennai,Mumbai,Hyderabad,Kolkata,C,45,NITI-Aayog has chosen the Council of Scientific & Industrial Research (CSIR) -Centre for Cellular and Molecular Biology (CCMB) in Hyderabad for hosting 10-crore Atal Incubation Centre for biotechnology start-ups. CCMB is one of the 10 organizations that have been identified to host the 'Atal Incubation Centre'.
1008,Who launches POSOCO-IMD Weather Portal for Power Sector & Web Portal 'MERIT'?,Shri Piyush Goyal,Shri Arun Jaitley,Shri Naveen Patnaik,Shri Ravi Shankar Prasad,A,45,"Union Minister for Power, Coal New & Renewable Energy Shri Piyush Goyal and Mines launches Weather Portal for Power Sector in association with POSOCO and IMD at the meeting of the Forum of Regulators. Day to day weather variations have an impact on load demand and energy production, transport and distribution management, as well as energy prices."
1009,What is the rank of India in the 2017 Social Progress Index (SPI)?,88th,93rd,105th,65th,B,45,"India has been ranked 93rd out of 128 countries in the 2017 Social Progress Index (SPI). The list is topped by Denmark, Finland, Iceland, Norway and Switzerland. The SPI is an aggregate index of social and environmental indicators that capture three dimensions of social progress: Basic Human Needs, Foundations of Wellbeing, and Opportunity."
1010,The World's first ATM celebrated its _________ anniversary recently.,100th,75th,50th,25th,C,45,"The World's first ATM celebrated its 50th anniversary with a British bank decorating the site of the world's first cashpoint in gold to mark the occasion. The first ATM was unveiled by Barclays at their Enfield branch in north London on 27 June, 1967. The invention of the ATM was a historical moment that completely changed the way the world thought about and used cash."
1011,"Which Indian sportsperson will be conferred with the East Bengal football club's highest honour ""Bharat Gaurav""?",Dhanraj Pillay,Mary Kom,Pusarla Venkata Sindhu,Sachin Tendulkar,A,45,"Former India hockey captain Dhanraj Pillay will be awarded East Bengal football club's highest honour - Bharat Gaurav on their foundation day. The ceremony will be held on August 1. He represented the country in four Olympics, World Cups, Champions Trophy and Asian Games. He played total 339 matches for India, scoring 170 goals."
1012,How many billion Euros are fined by the European Union to Google?,2.42,3,5,1.58,A,45,The European Union's competition watchdog fined Google a record 2.42 Billion Euro for breaching the anti-trust rules by illegally favoring its shopping service.
1013,This state signed an agreement with Asian Development Bank (ADB) for a loan of 1950 crore rupees for the strengthening of roads in the different district.,Haryana,Jammu Kashmir,Uttar Pradesh,Assam,C,45,Uttar Pradesh Government signed an agreement with Asian Development Bank (ADB) for a loan of 1950 crore rupees for the strengthening of roads in the different district. The project is scheduled to be completed by the year of 2024 and it will provide the loan for the period of 25 years on the interest rate of 2 percent.
1014,Which country test fired a submarine-launched Intercontinental Ballistic Missile?,China,India,Japan,Russia,D,45,The Russian military has successfully test-fired a submarine-launched Intercontinental Ballistic Missile (IBM). The Yuri Dolgoruky is the first in a series of Borei-class submarines carrying the Bulava.
1015,Which title did the Roger Federer won recently?,Halle Open title,French Open Tennis,World cup Tennis,VIVA Cup Tennis,A,45,Roger Federer won the ninth Halle Open title recently. He defeated Alexander Zverev from Germany.
1016,Which city has been designated as the UNESCO World Book Capital 2019?,Warsaw,Pune,Sharjah,Athens,C,45,"Sharjah, the city of United Arab Emirates (UAE), has been designated as the UNESCO World Book Capital 2019 by Irina Bokova, the Director-General of UNESCO, at the Headquarters of the International Federation of Library Associations (IFLA) at La Haye. Sharjah was the first emirate in UAE to establish a formal school and a library. It was also the first emirate to house many cultural institutions like the Emirates Publishers Association and the Emirates' writers Union."
1017,Maharashta Government formed this committee for Padma Awards 2018.,Chandrakant Patil committee,Ram Shinde committee,Sudhir Mungantiwar committee,Vinod Tawde committee,B,45,"The Maharashtra government has constituted an 11-member committee to scrutinize and recommend names from Maharashtra for the Padma Awards 2018 to the Government of India (GoI). The Padma awards seek to recognise work of distinction and exceptional achievements in different fields and disciplines such as art, literature and education, sports, medicine, social work, science and engineering, public affairs, civil service, trade and industry."
1018,Who is the new President of International Economic Association (IEA)?,Kaushik Rana,Kaushik Dave,Kaushik Saha,Kaushik Basu,D,45,"Kaushik Basu, an Indian economist, has taken over as new President of the International Economic Association (IEA) on June 23, 2017 and will serve the post for 3-years. He also served as senior vice-president and chief economist at the World Bank from 2012 to 2016."
1019,How many agreements are signed between India and Netherland?,5,2,3,4,C,45,"India and Netherlands signed 3 agreements between Prime Minister Narendra Modi and his Dutch counterpart Mark Rutte in Hague the Netherlands. It includes MOU on Cultural Cooperation, Water Cooperation and an Agreement on Amending Social Security Arrangement."
1020,"Under Which scheme the Union Ministry launched exchanged MoUs with SAP India, Intel and HMT?",Digital MSME Scheme,INSPIRE Program,Sarkari Yojana,Namami Yojana,A,45,"Union Minister of MSME Kalraj Mishra launched a new scheme, 'Digital MSME' Scheme for the micro, small & medium enterprise (MSME) sector and exchanged Memorandum of Understandings (MoUs) with SAP India, Intel and HMT."
1021,How many medals are bagged by the Indian shooting squad in Junior Shooting World Championship?,3,5,6,8,D,45,"The Indian shooting squad finished a creditable second at the International Shooting Sports Federation, Junior World Championship with three gold, two silver and three bronze medals in Suhl, Germany. China topped the event with 19 medals, including eight golds."
1022,Which company acquired Senso Motoric Instruments (SMI) recently?,Nokia,Apple,HP,Volfoni,B,45,"Apple acquired Senso Motoric Instruments (SMI) according to a report from MacRumors, it is specialized in eye-tracking technology. SMI has also offered eye-trackers for desktop applications as well as measurement-only head-worn devices for data collection and analysis."
1023,Which country citizen becomes the second largest group of migrants living in Australia?,Chine,French,India,Fiji,C,45,"Indians have become the second largest group of migrants living in Australia since 2011 at 1,63,000, following people of Chinese origin, according to the latest census data. The Australian Bureau of Statistics (ABS) released the latest figures of the country's fast changing population and demographics that has recorded 1.3 million new migrants settled in Australia since 2011 from around 180 countries, including India and China. The census updated the Australian population to 24.4 million people in 2016 from over 21.5 million in 2011."
1024,Rajiv Kumar appointed as Secretary of this state.,Maharashtra,Uttar Pradesh,Madhya Pradesh,Himachal Pradesh,B,45,The Uttar Pradesh government appointed Rajiv Kumar as the new Chief Secretary of the state. He replaces Rahul Prasad Bhatnagar.
1025,Who is the Ambassador of Indian Film Festival of Melbourne?,Amitabh Bachaan,Anil Kapoor,Vidya Balan,Sonam kapoor,C,45,"The Indian Film Festival of Melbourne (IFFM), which is supported by the Victorian Government, will run from August 10 to August 22 this year. Vidya Balan returns as the ambassador of the festival."
1026,Which is the first state in the Country to Open a Blood Bank for Cattle?,Goa,Kerala,Odisha,Andhra Pradesh,C,45,Odisha is all set to become the first state in the country to have a blood bank for the cattle. First of its kind blood bank would be established on the premises of OUAT at an estimated cost of Rs. 3.25 crore.The cattle farmers will provide blood voluntarily. The blood bank will also go and collect blood from centres.
1027,TS Vineeth Bhatt has been conferred with the 'Best astrologer of the world' award is belongs to ________.,Karnataka,Kerala,Tamil Nadu,Telangana,D,45,"Telangana's capital Hyderabad based astrologer and numerologist TS Vineeth Bhatt has been conferred with the 'Best astrologer of the world' award at the 'Russian-Indian economic dialogue' round-table meet held in Moscow. He is a personal astrologer to ministers, ambassadors, senators across the globe."
1028,Election Commission Of India joint hands with this social media for Voter Registration Reminder.,Facebook,Twitter,Instagram,LiveChat,A,45,The Election Commission of India has joined hands with Facebook to launch nationwide voter registration reminder aimed at reminding eligible Indian voters to register themselves on the electoral rolls. Facebook will activate a unique 'Register Now' button reminding all the eligible Indian users to enrol themselves as voters. The remainder will be made available for four days beginning July 1.
1029,Which Indian state was conferred with the award of excellence at the 2nd Global Skill Development Summit held in Paris?,Haryana,Odisha,Uttarakhand,Punjab,C,45,Uttarakhand was conferred with the award of excellence at the 2nd Global Skill Development Summit held in Paris recently for innovations and extensive use of IT for skilling the state's youth. Project Director of Uttarakhand Skill Development Committee Pankaj Kumar Pandey received the honour.
1030,What types of Lights are produced by the scientists recently?,X ray lights,Halogen Lights,CFL Lights,Light Emitting Diode (LED) bulbs,A,45,"The Scientists have created the brightest light ever produced on the Earth, shining a billion times stronger than the surface of the Sun. It used a new type of X-ray, capable of taking higher resolution images. These lights are used for the safety purposes."
1031,The weight of GSAT-17 communication Satellite launched by the Indian Space Research Organisation (ISRO) is?,"4,500-kg","4,477-kg","3,499-kg","3,477-kg",D,45,"The Indian Space Research Organisation (ISRO) GSAT-17 communication Satellite onboard the Ariane-5 launch vehicle from the Guiana Space Center at French Guiana. Its weight is about 3,477-kg and will be placed in the Geostationary orbit which has a mission life of 15 years."
1032,How many members are slected for the committee to identify the 'few critical points' for the general body of the cricket board?,5,7,4,9,B,45,"The Board of Control for Cricket in India (BCCI) announced the formation of a special seven-member committee to identify the 'few critical points' for the general body of the cricket board to consider before they are submitted to the Supreme Court. The seven-member committee has Rajeev Shukla, Sourav Ganguly, Naba Bhattacharjee, TC Mathew, Jay Shah,Amitabh Choudhary and Anirudh Chaudhary."
1033,Which country launched its Biggest Naval Destroyer?,South Korea,Sri Lanka,China,Iraq,C,45,"China launched its most powerful naval destroyer, the Type 055, at the Shanghai port. It is one among the largest warships in the world."
1034,With Which country India attended the Sixth Joint Trade Committee Meeting recently?,Mynamar,United States of America,Russia,Japan,A,45,"The Joint Trade Committee plays a key role related to the enhancement of the bilateral economic partnership between India and Mynamar. Myanmar shares a long land border of over 1600 Kms with India as well as a maritime boundary in the Bay of Bengal. The Sixth India - Myanmar Joint Trade Committee (JTC) Meeting co-chaired by Smt. Nirmala Sitharaman, Minister of Commerce & Industry from India and Dr Than Myint, Union Commerce Minister from Myanmar was held in New Delhi."
1035,He is appointed as the National Institute of Fashion Technology (NIFT) chairperson.,Shri Rajesh Varma,Shri Rajesh V. Shah,Shri Narayana Swamy,Shri Sekar raj,B,45,"The Union Government (Ministry of Textiles) appointed Shri Rajesh V. Shah as Chairperson on the Board of Governors of the National Institute of Fashion Technology (NIFT). He has replaced Shri Chetan Chauhan as per the provisions of the National Institute of Fashion Technology Act, 2006."
1036,Donald Trump appointed Indian-American Krishna R as the new United States Ambassador to _________.,Maldives,Grenada,Palau,Peru,D,45,"Donald Trump appointed Indian-American Krishna R as the new United States Ambassador to Peru. He is serving as Charge of Affairs of the United States Embassy in Madrid, Spain."
1037,Which day is celebrated on June 29?,Icelandic National Day,National Doughnut Day,National Cancer Survivors Day,National Statistics Day,D,45,"On June 29, National Statistics Day is celebrated to mark the birth anniversary of Prof. Prasanta Chandra Mahalanobis, a renowned and eminent statistician. The first National Statistics Day was celebrated on 29th June, 2007."
1038,This country becomes 1st to give to UN Tax Fund with $100000 contribution.,Russia,India,China,Japan,B,45,"India has contributed $100,000 to a United Nations fund to help developing countries actively participate in the discussion of tax issues, becoming the first country to make the contribution. The UN Tax Committee a subsidiary body of the UN Economic and Social Council (ESOSOC) provided guidance on current issues such as double taxation treaties."
1039,Which country has officially started building the world's first forest city?,Japan,Singapore,Bhutan,China,D,45,"China has officially started building the world's first forest city in the north of Liuzhou, Guangxi Province to fight against pollution and climate change, which is set to be completed in 2020. It is designed by Stefano Boeri Architetti, a team that develops green projects all around the world. The Liuzhou Forest City is expected to absorb nearly 10,000 tonnes of carbon dioxide yearly and produce 900 tonnes of oxygen."
1040,"India's first-ever mega textiles trade event ""Textiles India 2017"" has started in ___________.",Gandhinagar,Surat,Palanpur,Porbandar,A,45,"India's first-ever mega trade event for the textiles sector has inaugurated by the Prime Minister Narendra Modi at Mahatma Mandir in Gandhinagar, Gujarat on June 30, 2017. The event 'Textiles India 2017' has been organised by the Union Ministry of Textiles with an aim to showcase the country as a global sourcing hub and investment destination. The three-day conference is expected to see participation from 2,500 international buyers, over a 1,000 international and domestic exhibitors and several top fashion designers."
1041,"Which union minister has launched a new training programme ""COMMIT"" for State Government officials?",Jitendra Singh,Ravi Shankar Prasad,Arun Jaitley,Prakash Javadekar,A,45,"Minister of State for Development of North Eastern Region Dr Jitendra Singh Personnel, Public Grievances & Pensions, Atomic Energy and Space launched a new training programme Comprehensive Online Modified Modules on Induction Training (COMMIT) for State Government officials. The main objective of this training programme is to improve the public service delivery mechanism and provide citizen-centric administration through capacity building of officials who interact with the citizens on a day-today basis."
1042,"Which state CM launches the establishment of Micro, Small, Medium Entrepreneurs (MSME) Development Corporation recently?",Bihar,Andhra Pradesh,Telangana,Gujarat,B,45,"Andhra Pradesh Chief Minister CM Chandrababu launches the establishment of Micro, Small, Medium Entrepreneurs (MSME) Development Corporation at Vijayawada with a fund of Rs.100 crore on the occasion of International MSME Day. MSME parks would be developed in 100 to 150 acres of land in various districts."
1043,This Indian company has signed pact with Japanese firm Kawasaki Heavy Industries Ltd (KHI) to make steel metro coaches.,Tata Steel,ONGC,BHEL,SAIL,C,45,"The Bharat Heavy Electricals Limited (BHEL) has signed an agreement with Kawasaki Heavy Industries Ltd (KHI) of Japan to manufacture stainless steel coaches and bogies for metro rail. The agreement covers establishing state-of-the-art design, engineering and manufacturing facilities at BHEL using Japanese technology."
1044,"Which board to launch new housing scheme with 12,000 flats recently?",Housing Board Haryana,Tamil Nadu Housing board,Kendriya Awas Housing Society,Delhi Development Authority (DDA),D,45,"The Delhi Development Authority (DDA) new housing scheme with 12,000 flats on offer will be launched. For the LIG (Lower Income Group) category,the registration fee will be Rs1 lakh while for Middle Income Group and High Income Group flats, Rs2 lakh will be charged. It has tied up with 10 banks for the sale of application forms and scheme-related transactions."
1045,Which company received World's Second Highest Green Rating?,SIERRA ODC Coimbatore,World Green Building council,HongKong Green Building,Green MaG,A,45,"SIERRA ODC building is recognised as the world's second highest ranking Green Building. It is a three-storeyed building which has been constructed by laying specific emphasis on increasing the efficiency of resource use such as energy, water or materials."
1046,United States Of America issues New visa Criteria for visa applicants of _______ Muslim countries.,3,5,6,4,C,45,"United States Of America issues New visa Criteria for visa applicants from six Muslim countries. The countries were Iraq, Iran, Libya, Yemen, Somalia, Sudan and Syria. The applicants from the six Muslim-majority countries must prove a relationship with a parent, spouse, child, adult son or daughter, son-in-law, daughter-in-law or sibling in the United States of America."
1047,Who inaugurated the filling of Aji Dam at Rajkot by Narmada water?,Shri Arun Jaitley,Shri Narendra Modi,Shri Naveen Patnaik,Shri Suresh Prabhu,B,45,Prime Minister Narendra Modi inaugurates filing of Aji dam with Narmada waters under Sauni Yojana. He launched Smart Rajkot Hackathon where the urban local body will engage with young students to find innovative solutions to improve the efficiency of various Government departments.
1048,NALSA launched a Web Application for free Legal Services to ________.,Prisoners,Criminals,Lawers,None of the above,A,45,"The National Legal Services Authority (NALSA) launched a Web Application for free Legal Services to prisoners, and the Legal Services Management System developed through the NIC. Through the Web Application, the information regarding legal representation of individual prison inmates will be fed by the State Legal Services Authorities and District Legal Services Authorities."
1049,Which aircraft has been sold by the United States of America?,Lockheed Martin,General Dynamics,C-17 Globemaster,McDonnell Aircraft,C,45,"The United States of America (USA) decided to sell one C-17 transport aircraft to India. The sale of USD 366.2 million C-17 transport aircraft manufactured by Boeing also includes one Missile Warning System, one Countermeasures Dispensing System, one Identification Friend or Foe (IFF) Transponder and precision navigation equipment."
