id,Question,optionA,optionB,optionC,optionD,correct_option,Time,Explanation
1,Which bank became India's most-valued Public Sector Unit (PSU) in terms of market valuation?,State Bank of India,Punjab National Bank,Union Bank of India,Reserve Bank of India,A,45,"State Bank of India (SBI) become the country's most valuable public sector unit (PSU), in terms of market valuation."
2,Identify the English businesswoman and fashion designer who was recently appointed the Officer of the Order of the British Empire.,Samantha Cameron,Victoria Beckham,Michelle Dewberry,None of the above,B,45,Victoria Beckham on 19 April 2017 was appointed the Officer of the Order of the British Empire (OBE) for services to the fashion industry.
3,Prime Minister Narendra Modi will inaugurate the Day of Vesak in Sri Lanka. The day is celebrated on which date?,12-May,13-May,14-May,15-May,A,45,"Prime Minister Narendra Modi will inaugurate the14th United Nations Day of Vesak celebration in Sri Lanka on May 12 under the theme 'Buddha's Teachings, Social Justice and Sustainable World Peace', Minister of Justice and Buddhasasana"
4,The Civil Services Day (CSD) is celebrated on which day in India?,20-Apr,21-Apr,18-Apr,27-Apr,B,45,"The Civil Services Day is organized on 21st April every year, when civil servants re-dedicate themselves to the cause of the citizens and renew their commitment to public service. This day coincides with the date on which SardarVallabhbhai Patel had addressed the first batch of probationers at the All India Administrative Service Training School at Metcalfe House, New Delhi in 1947."
5,Which e-tailer has acquired logistics start-up InLogg to smooth its delivery process?,Jabong,Myntra,Flipkart,Snapdeal,B,45,"Flipkart-owned fashion e-tailer Myntra has acqui-hired logistics startup InLogg, which is operated by InLogg Intenet Pvt. Ltd, to help solve delivery inefficiencies in terms of cost and reach, it said in a statement."
6,Who is the author of the book One Part Woman that in recent past was chosen for Sahitya Akademi's award for translation in English?,Aniruddhan Vasudevan,Ashwani Kumar,Anand Neelakanthan,Yasser Usman,A,45,The English translation of writer Perumal Murugan's novel Mathorubhagan (One Part Woman) has won the Sahitya Akademi's award for translation in English. The translation was done by Aniruddhan Vasudevan and the book was published by Penguin.
7,Who is nominated for the prestigious Raj Kapoor Lifetime achievement award of the Maharashtra Government?,Vikram Gokhale,Amitabh Bachchan,Saira Banu,Jackie Shroff,C,45,"Veteran actress Saira Banu and actor Jackie Shroff have been named for the prestigious Raj Kapoor Lifetime Achievement and Raj Kapoor Special Contribution annual awards, respectively, by the Maharashtra government"
8,Which country abolished its 457 Visa programme which is used largely by Indians?,Canada,Australia,New Zealand,UAE,B,45,"The programme, known as 457 visa, allows business to employ foreign workers for a period up to four years in skilled jobs where there is a shortage of Australian workers."
9,Which city will host the main event of the International Day of Yoga (IDY) celebrations in June 2017?,Karnal,Bhopal,Lucknow,Bengaluru,C,45,"Lucknow, the city of Nawabs, has been finalised to host the main event of the International Day of Yoga (IDY) celebrations. A team of Ayush Ministry officials visited Lucknow and shortlisted Ramabai Ambedkar Maidan, Baudh Vihar Shanti Upvan and Janeshwar Mishra Park as possible venues for the third edition of IDY."
10,Which Indian made it to the Times 100 Influential People list of 2017?,Mukesh Ambani,Anil Ambani,Narendra Modi,Kapil Sharma,C,45,Prime Minister Narendra Modi and Paytm founder Vijay Shekhar Sharma were the only two Indians to make it to an annual list of '100 most influential people in the world' this year released by the Time magazine
11,Which airline became the world's first airline to adopt new satellite-based airplane tracking system?,Malaysia Airlines,Japan Airlines,Singapore Airlines,Asiana Airlines,A,45,"Malaysia Airlines is first to sign up to a new service that will track its airplanes anywhere in the world using orbiting satellites. The company's planes will be tracked minute-by-minute using the new system, which boasts complete worldwide coverage,even over ""ocean, polar, and remote regions""."
12,"A set of four rare stamps, featuring the portrait of Mahatma Gandhi was auctioned in UK at highest price ever paid for Indian stamps. These stamps were sold at what price?",1 lakh pounds,3 lakh pounds,5 lakh pounds,7 lakh pounds,C,45,"A set of four rare stamps featuring with portraits of Mahatma Gandhi has been sold for a record &pound;500,000 at an auction in the UK. The Indian stamps were particularly rare owing to the fact they were in a set of four."
13,"Which report was published by the World Wide Fund for Nature (WWF) to highlight that nearly 30% of World Heritage Sites are plagued by poaching, illegal logging and fishing?",Save the Heritage,Heritage Species,Heritage Action,Not For Sale,D,45,"Not For Sale is published by the World Wide Fund for Nature (WWF), nearly 30% of World Heritage Sites are plagued by poaching, illegal logging and fishing."
14,Which country's former president has been disqualified from running in the upcoming presidential elections?,France,Iran,India,Germany,B,45,"Iran's former President Mahmoud Ahmadinejad has been disqualified from running in next month's presidential election. The decision was taken by the Guardian Council, a clerical body charged with vetting candidates for the May 19 election."
15,The high court judges of which state have decided to give up the red beacon lights much before the set deadline?,Delhi,Maharashtra,Tamil Nadu,Uttar Pradesh,A,45,Chief Justice J S Khehar set an example for other judges by implementing on Thursday the Centre's decision to curb VIP culture by banning use of red beacon atop official cars irrespective of the Constitutional post.
16,"Dr Bhakti Yadav, popularly known as Doctor Didi, was recently presented with Padma Shri award at her residence to recognise her service to the poor. Which state does she belong to?",Maharashtra,Uttar Pradesh,Madhya Pradesh,Odisha,C,45,"Dr Bhakti Yadav, the first woman doctor from Indore, was conferred the award in recognition of her service to the poor. She is the first female MBBS doctor from Indore and her inspiring spirit to serve patients till her last breath is laudable."
17,"Which state government is planning to set up ""Book Banks"" in schools to provide old books to needy students?",Punjab,Gujarat,Uttar Pradesh,Rajasthan,A,45,"Chandigarh, The Punjab government has decided to set up book banks in different schools so that needy students do not have to buy books at the start of every academic year and also to prevent ""wastage of paper""."
18,Name the state whose Chief Minister ordered a review of the prestigious Yash Bharti Awards that were started by the previous government.,Punjab,Uttar Pradesh,Manipur,Uttarakhand,B,45,"Uttar Pradesh chief minister Yogi Adityanath has ordered a review of the Yash Bharti awards conferred on personalities from various fields during the previous Samajwadi Party regime. The tradition of giving away the honour which includes a cash award of Rs 11 lakh and Rs 50,000 in monthly lifetime pension."
19,Parliament of this country in April 2017 decided to transfer the control of royal agencies from the government to the new King Maha Vajiralongkorn.,Myanmar,Thailand,North Korea,United Arab Emirates,B,45,The Parliament of Thailand on 20 April 2017 agreed to transfer control of royal agencies from the government to the new King Maha Vajiralongkorn. Members of the military-appointed legislature said that the decision was taken in a confidential session.
20,The UN Chinese Language Day is observed on which date?,Apr-23,Apr-20,Apr-21,Apr-22,B,45,"The UN Chinese Language Day is observed every year on April 20 by the United Nations Educational, Scientific and Cultural Organization (UNESCO) to raise awareness and respect for the history, culture and achievements of each of the six official languages of the world body. April 20 was chosen as the date for the Chinese language to pay tribute to Cang Jie, a mythical figure who is presumed to have invented Chinese characters about 5,000 years ago."
21,Which country to host 2017 BRICS Film Festival?,Russia,South Africa,China,India,C,45,"The 2017 BRICS Film Festival will be held in Chengdu, southwest China's Sichuan Province from June 23 to 27. During the festival, 30 films from BRICS countries (Brazil, Russia, India, China and South AfricA) will be screened, including an anthology by five directors from the aforementioned countries, ""Where has the time gone"". The feature film consisting of five 18-minute shorts on the same theme is a joint work by Walter Salles from Brazil, Aleksey Fedorchenko from Russia, Madhur Bhandarkar from India, Jahmil X. T. Qubeka from South Africa, and Jia Zhangke from China."
22,Giuseppina Nicolini has been honoured with the 2017 Felix Houphouet Boigny Peace Prize. She hails from which country?,Italy,France,Germany,Norway,A,45,"The 2017 Felix Houphouet-Boigny Peace Prize has been awarded to Giuseppina Nicolini, Mayor of Lampedusa (Italy) and to the nongovernmental organization 'SOS Mediterranee (France)' for their work to save the lives of refugees and migrants and welcome them with dignity. SOS Mediterranee is a civic, European organization for the rescue of people in distress in the Mediterranean. The prize includes a cheque of USD 150,000, a gold medal and a peace diploma."
23,Which country to host the first-ever World Ocean Festival (WOF)?,England,Japan,India,United States,D,45,"The first-ever World Ocean Festival (WOF) will be held in New York City, United States from June 4, 2017, which will be organized by the Global Brian Foundation (GBF). As part of the festival, activists and enthusiasts will take to the streets and waterways of New York City to raise their voices to reverse the declining health of our oceans."
24,Which Indian cricketer will be honoured with the 75th Master Dinanath Mangeshkar award for his outstanding contribution to Indian Cricket?,Gundappa Viswanath,Sunil Gavaskar,Kapil Dev,Ravi Shastri,C,45,"The cricket icon Kapil Dev will be honoured with the 75th Master Dinanath Mangeshkar award on April 24, 2017 for his outstanding contribution to Indian Cricket. Beside this, Actor Aamir Khan will be honoured with the Vishesh Puraskar for Best Film ""Dangal"". Apart from this, legendary actress Vyjayanthimala Bali will be honoured with Master Dinanath Vishesh Puraskar for her achievements in Hindi cinema."
25,Which All India Radio (AIR) has been honoured with the 26th edition of Lelte Award?,AIR Aizawl,AIR Bhopal,AIR Lucknow,AIR Delhi,A,45,"The All India Radio (AIR) Aizawl has been honoured with the prestigious Lelte Award at an impressive 26th Award Ceremony held at Chanmari YMA Hall in Aizawl. The award is given in recognition of the role played by AIR Aizawl for the overall progress &amp; development of Mizoram and for promotion of Mizo language &amp; literature and for its contribution in the field of healthcare &amp; education and in promotion of brotherhood. The Lelte Special Award was received by D R Lalropuia, Director (E) &amp; Head of Office."
26,India has recently signed pact with which country for defence shipbuilding?,Japan,Australia,South Korea,China,C,45,"India and South Korea has recently signed an agreement to firm up bilateral cooperation in defence shipbuilding. The agreement will form the basis of defence cooperation between the two countries in shipbuilding. Under the MoU, the two sides will nominate one shipyard each for this purpose.India has already picked Hindustan Shipyard Limited (HSL) while Korea will make the nomination soon."
27,Which Food delivery and home services app was launched by Google for Indian market?,Ambrosia,Delicay,G-kitchen,Areo,D,45,"Google launches the Areo app that aggregates food delivery and home services start-ups in India. It's currently operational in Mumbai and Bengaluru. Google has partnered with companies such as Box8, Freshmenu and Faasos for food delivery and UrbanClap and Zimmber for home services."
28,Which country is going to launch its first cargo spacecraft into space?,Russia,Japan,India,China,D,45,"China launched its first unmanned cargo spacecraft on a mission to dock with the country's space station, marking further progress in the ambitious Chinese space program. It was powered by a Long March-7 Y2 carrier rocket, Tianzhou-1 roared into the air from the Wenchang Space Launch Centre in the southern Hainan Province, state-run Xinhua news agency reported."
29,The 11th Civil Services Day was celebrated on?,18-Apr-17,19-Apr-17,20-Apr-17,21-Apr-17,D,45,"Every year, the Civil Services Day is observed on April 21. In the event, 8 break away sessions were held on the replication initiatives awarded by the Prime Minister and 4 Priority Programmes, the names of which include; 'PradhanMantri Jan DhanYojana', 'Swachh Bharat (Gramin)', 'SwachhVidyalaya' and 'Soil Health Card'."
30,The first India-Indonesia Energy Forum was held in?,Jakarta,New Delhi,Mumbai,Bali,A,45,"Union Minister of State (IC) for Power, Coal, New & Renewable Energy and Mines, Shri Piyush Goyal and H.E. Mr. Ignasius Jonan, Minister of Energy and Mineral Resources, Republic of Indonesia met on 20th April, 2017 for the 1st 'India Indonesia Energy Forum', held in Jakarta, Indonesia."
31,Pakistan has leased the Gwadar Port to a company belonging to this country for 40 years.,Sri Lanka,India,China,Germany,C,45,A state-run Chinese company will handle the operations of Pakistan's strategic Gwadar port for a period of 40 years. Minister for Ports and Shipping Mir Hasil Khan Bizenjo said the China Overseas Port Holding Company (COPHC) would carry out all the development work on the port on the Arabian Sea. The COPHC has 91 per cent share of revenue collection from gross revenue of terminal and marine operations and 85 per cent share from gross revenue of free zone operation
32,Sulkhan Singh was appointed as the DGP of,Telangana,Uttar Pradesh,Bihar,Karnataka,B,45,"Sulkhan Singh was appointed as the new director general of police, replacing Javeed Ahmed who has been posted as DG, PAC by the Yogi Adityanath-led state government. Sulkhan Singh, the 1980 batch IPS officer, would be heading the police department of Uttar Pradesh. He was currently posted in the Training Department of UP police."
33,This State Government announced the establishment of 40 yoga wellness centres recently.,Haryana,Maharashtra,Uttar Pradesh,Madhya Pradesh,C,45,"Uttar Pradesh Chief Minister Yogi Adityanath has directed officials to set up yoga wellness centres in 40 districts of the state. Out of 40 centres, 23 will be set up at Ayurvedic hospitals, 12 at homeopathic and 7 at Unani hospitals and colleges. For setting up of wellness centres in the remaining 35 districts, the state government plans to get assistance from union government."
34,"By divesting it's 9.2% stake in NALCO, the Union Government has raised","Rs 1,200 crore","Rs 2,200 crore","Rs 3,200 crore","Rs 4,200 crore",A,45,"The Central Government has raised Rs. 1,200 crore by divesting 9.2% of paid-up capital in National Aluminum Company Ltd. (NALCO). With this disinvestment, Government's shareholding in NALCO has become 65.37%."
35,The Government of this State announced plans to develop the birthplace of Srimanta Sankardev Batadrava as an international tourist spot recently.,Assam,West Bengal,Kerala,Maharashtra,A,45,Assam Chief Minister Sarbananda Sonowal has mooted an idea of developing the birthplace of Srimanta Sankardev Batadrava as an international tourist spot and plans to place it in the national and international tourist circuit. The state government plans to develop the birthplace on the lines of the Golden Temple of Amritsar.
36,Which country will host the 2017 BRICS Film Festival?,Brazil,India,China,Russia,C,45,"The 2017 BRICS Film Festival will be held in Chengdu, southwest China. There will be 30 films from BRICS countries (Brazil, Russia, India, China and South Africa) screened during the festival, including an anthology by five directors from the aforementioned countries."
37,Which of the following States was/were chosen for Krishi Samman Awards 2015-16?,Tamil Nadu,Himachal Pradesh,Tripura,All of them,D,45,"The Union Ministry of Agriculture and Farmers Welfare in April 2017 selected Tripura, Himachal Pradesh and Tamil Nadu for the Krishi Karman Awards 2015-16. The objective of these awards is to encourage and motivate the states to enhance production and productivity of rice, wheat, pulses and coarse cereals and oilseeds."
38,Who will be honoured with the 75th Master Dinanath Mangeshkar Award?,Sachin Tendulkar,Sunil Gavaskar,Kapil Dev,Sourav Ganguly,C,45,"Aamir Khan and cricket icon Kapil Dev will receive the 75th Master Dinanath Mangeshkar Awards. The Other awardees include Kishore Deshpande, who will be presented with Anadmayee Puraskar for his work in social service, Vishwanath Karad, founder, Vishwashanti Kendra will be presented with Samarpit Jeevan Puraskar."
39,India contributed this much amount to the Election Commission Division of the UN recently.,"USD 1,50,000","USD 2,50,000","USD 3,50,000","USD 4,50,000",B,45,"India has made a quarter-million-dollar contribution to the UN programme for helping countries to hold elections and develop their electoral systems. This is the second Indian contribution of $250,000 to the programmes for electoral assistance and capacity building."
40,Which country will host the first-ever World Ocean Festival?,The USA,The UK,Japan,The Netherlands,A,45,"The UN announced the launch of inaugural World Ocean Festival from June 4, 2017. The festival will be held in New York City. The festival will aim to show world leaders gathering for the UN conference the urgency for taking action. As part of the festival, activists and enthusiasts will take to the streets and waterways of New York City to raise their voices to reverse the declining health of our oceans."
41,"As per an estimate of the IMF, the projected global economic growth for 2017 is",1.50%,2.50%,3.50%,4.50%,C,45,"The global economy is forecast to grow 3.1% in 2016 compared with 3.2% estimated in the April WEO, with Brexit responsible for the reduction. The 2017 growth estimate has also been trimmed by 0.1 percentage point, to 3.4%."
42,With this country India signed a MoU to cooperate in the field of defence shipbuilding.,China,Japan,South Korea,Poland,C,45,"India and South Korea signed an agreement today to firm up bilateral cooperation in defence shipbuilding. MoU conceived under the umbrella of the special strategic partnership, the two sides will nominate one shipyard."
43,"It is in this State, the NDMA conducted a mock exercise on forest fires recently.",Uttar Pradesh,Uttarakhand,Himachal Pradesh,Punjab,B,45,The National Disaster Management Authority (NDMA) conducted a first-of-its-kind State-level mock exercise on forest fire in Uttarakhand. It is aimed at assessing the efficacy of integrating the preparedness and response mechanisms of the forest department with those of the district administration.
44,Sulkhan Singh is appointed as new DGP of which state?,Rajasthan,Uttar Pradesh,Punjab,Kerala,B,45,Sulkhan Singh appointed as new Director General of Police (DGP) of Uttar Pradesh on 21st April 2017. Uttar Pradesh DGP Javeed Ahmed has been transferred.
45,"What does VVPAT stand for, in voting?",Voters View Paper Audit Trail,Voter Verified Paper Audit Trail,Votee and Action on Time,Voter Verifiable Paper Audit Trail,D,45,"Union Cabinet chaired by the Prime Minister Shri Narendra Modi has given its approval for procurement of Voter Verifiable Paper Audit Trail (VVPAT) Units for use in the General Elections, 2019."
46,Mastercard creates credit card with __________ scanner.,Fingerprint,Retina,Voice,Eye,A,45,"MasterCard has unveiled its brand new payment card that has a built-in biometric fingerprint scanner, allowing customers to authorize payments with their fingerprint, without requiring a PIN code or a signature."
47,PV Sindhu moves to _______ position in world ranking.,3rd,8th,7th,5th,A,45,P.V. Sindhu moved to number 3. Slipping to number five. Sindhu earned two spots in the latest ranking on the basis of making the quarterfinals of the recently concluded Singapore Open Super Series.
48,Rupee weakens ______ paise against dollar at 64.65.,9 paise,10 paise,6 paise,7 paise,A,45,The rupee weakened by 9 paise to 64.65 against the dollar in early trade at the Inter- bank Foreign Exchange market on increased demand for the American currency from importers and banks.
49,Which Bollywood film has won the best film honour at the 2017 Hong Kong International Film Festival?,Trivisa,Newton,Happiness,Blue Mountains,B,45,"Bollywood film ""Newton"" has won the best film honour at the Hong Kong International Film Festival. It had its world premiere at the 67th Berlin Film Festival where it won the International Federation of Art Cinemas (CICAE) award in its Forum segment."
50,Which state government has recently signed MoU with Indian Railways to expand green cover?,Kerala,Uttar Pradesh,Maharashtra,Rajasthan,C,45,"The Maharashtra government recently signed the Memorandum of Understanding (MoU) with the Railways, under which trees will be planted on the land adjacent to the railway tracks in the state."
51,Which country to host 15th edition of International Musculoskeletal Congress (IMC)-2017?,India,China,Japan,South Korea,D,45,"The 15th edition of WFH International Musculoskeletal Congress (IMC) will be held in Seoul, South Korea from May 5-7, 2017, which is been organized by the World Federation of Hemophilia (WFH) and the Korea Hemophilia Foundation. The purpose of IMC is to bring together orthopedic surgeons, physical therapists, physiatrists, rehabilitation medicine specialists, rheumatologists, hematologists, scientists, researchers, and other health professionals from around the world to discuss a variety of surgical and non-surgical approaches to the prevention and management of hemophilic arthropathy."
52,Which Indian bank has won the 2017 Golden Peacock Innovative Product/Service Award (GPIPSA)?,Yes Bank,ICICI Bank,State Bank of India (SBI),Reserve Bank of India (RBI),A,45,"Yes Bank has won the prestigious 2017 Golden Peacock Innovative Product / Service Award (GPIPSA) at the 27th World Congress at the Dubai Global Convention in Dubai, UAE. And Gujarat Narmada Valley Fertilizers &amp; Chemicals Ltd (GNFC) also won the award in this category for pioneering a cashless township transformation model. The Golden Peacock Awards raise the overall standards of developing and implementing transformative business models, and to recognize the achievements of the best performing organizations."
53,The Marylebone Cricket Club (MCC) has offered honourary life membership to which Indian women cricket player?,Mithali Raj,Sandhya Agarwal,Veda Krishnamurthy,Poonam Ganesh Raut,B,45,"The Marylebone Cricket Club (MCC) has offered honourary life membership to Sandhya Agarwal, former captain of the Indian women's Test team. Agarwal is being honoured in recognition of her distinguished service to the game. She has played 13 Tests and 21 ODIs from 1984 to 1995."
54,What is the theme of the India Pavillian during the Arabian Travel Market (ATM) 2017?,Yoga and Spirituality,Yoga and Nature,Yoga and Wellness,Yoga and Health,C,45,"The theme of the India Pavilion is ""Yoga and Wellness"", which will depict India as a year round multi faceted tourist destination for all ages and all seasons. The pavilion will highlight medical tourism in India which is fast gaining currency both amongst Middle East and European travellers.The Indian Pavilion under the aegis of the Tourism Ministry will exhibit the grandeur of the Indian subcontinent and will provide a platform to the leading Indian tour operators, travel agents, hoteliers, state governments and airlines to market India as an affordable and exotic tourist destination, which can be the basis of holistic travel experience."
55,Who has been appointed the new interim President of Badminton Association of India (BAI)?,Viraj Sagar Das,Kuki Juneja,Sudhanshu Gupta,Himanta Biswa Sarma,D,45,"Himanta Biswa Sarma, the BJP leader and Assam Badminton Association President, has been appointed the new interim President of Badminton Association of India (BAI)."
56,Which Indian personality has won the 2017 Goldman Environmental Prize?,Prafulla Samantra,Rashida Bee,Champa Devi Shukla,Ramesh Agrawal,A,45,"Prafulla Samantra, an iconic leader of social justice movements in India, the Goldman Environmental Prize for his historic 12-year legal battle that affirmed the indigenous Dongria Kondh's land rights and protected the Niyamgiri Hills from a massive, open-pit aluminum ore mine."
57,The National Panchayati Raj Diwas is celebrated on which date in India?,Apr-23,Apr-24,Apr-22,Apr-25,B,45,The National Panchayati Raj Diwas is celebrated every year on April 24 across India to mark the passing of the Constitution (73rd Amendment) Act 1992 that came into force with effect from 24 April 1993.
58,Who has won the 2017 Men's Singles title of Monte Carlo Masters Tennis tournament?,Albert Vinolas,Roger Federer,Rafael Nadal,Novak Djokovic,C,45,"Rafael Nadal, a Spanish professional tennis player, has won the Men's Singles title of Monte Carlo Masters Tennis tournament by defeating Albert Vinolas by 6-1, 6-3 at a summit clash in Monaco."
