id,Question,optionA,optionB,optionC,optionD,correct_option,Time,Explanation
515,What is the name of the Light Utility Helicopter which completed its first flight in Bengaluru?,Hughes OH-6 Cayuse,Sikorsky CH-54,Boeing CH-46 Sea Knight,LUH PT2,D,45,The second prototype of the Light Utility Helicopter(LUH PT2) completed its first flight for 22 minutes in Bengaluru. The aircraft is capable of reaching a maximum height of 6.5 Km and can carry a payload of 400 kg. It is being designed to fly 350 km non-stop at a speed of 220 kilometers per hour.
516,"Airlander 10, the world's largest aircraft has successfully completed a test flight in ____________.",United states,United Kingdom,Russia,Isreal,B,45,"The world's largest aircraft has successfully completed a test flight,bringing the massive helium-filled airship in Cardington, United Kingdom. It is 92-metre-long and 43.5m wide and designed to fly at altitudes of 6,100 meters and reach speeds of 148 kilometers per hour."
517,Which of the following company appointed Shuva Mandal as the new head of Group General Counsel?,Reliance Industries,Aditya Birla,TATA Group,Amul,C,45,"Tata group announced the appointment of Shuva Mandal as Group General Counsel to succeed incumbent Bharat Vasani, who is set to move to a strategic and advisory role."
518,Who published the book Confessions of a dying mind: the blind faith of atheism?,Haulianlal Guite,Bandana Devi,M.J. Pradip Chandren,Jaspreet Kaur,A,45,"A young Indian IAS officer, Haulianlal Guite, published a book titled ""Confessions of a dying mind: the blind faith of atheism"" in New Delhi. The book explores interesting arguments against atheism. It also explores the nature of science, religion, evidence and love. The book explores the nature of science, religion, evidence and even love in light of leading developments."
519,Who will become the new Prime Minister of Nepal?,Sher Bahadur Deuba,Girija Prasad Koirala,Bidhya Devi Bhandari,Sushil Koirala,A,45,"Sher Bahadur Deuba, the chief of the Nepali Congress, will become the new Prime Minister of Nepal, after Pushpa Kamal Dahal ""Prachanda"" resigned from the post. Deuba was elected as the 39th Prime Minister of Nepal."
520,What is the name of the new chairperson of the National Commission for Minorities?,Praveen Davar,Gayarul Hasan,Mukhtar Abbas Naqvi,George Kurian,B,45,"Gayarul Hasan was appointes as the chairperson of the National Commission for Minorities (NCM). The Union government has appointed 7 members in the minorities panel the other members are Activist and BJP leader from Kerala George Kurian, former Maharashtra minister Sulekha Kumbhare, Jain representative from Gujarat Sunil Singhi and Vada Dasturji Khurshed, chief priest of Udvada Athornan Anjuman."
521,On which date the World Turtle Day is observed?,May 21st,May 22nd,May 23rd,May 24th,C,45,World turtle day is celebrated on May 23. It is aimed at protecting turtles and tortoises and their rapidly disappearing habitats across the world.
522,The Ozone2Climate Technology Roadshow was organished in _____________.,Lucknow,Meerut,Varanasi,Agra,D,45,"The Ministry of Environment, Forest and Climate Change, along with the UN Environment OzonAction's Compliance Assistance Programme, organized an ""Ozone2Climate"" Technology Roadshow in Agra. The Technology Roadshow was organized for the first time as part of the annual network meeting for Ozone Officers of South Asia. It had 13 exhibitors that promoted ozone and climate-friendly alternative technologies to HCFCs and HFCs in the refrigeration and air-conditioning (RAC) sector."
523,Which two Indian cities are named as the world's most crowded cities?,Mumbai and Delhi,Mumbai and Kota,Pune and Delhi,Jaipur and Kota,B,45,"World Economic Forum refers UN-Habitat data named two Indian cities-Mumbai and Kota among the world's most crowded cities. Mumbai has a population density of 31,700 people per square kilometer. Kota in Rajasthan with 12,100 people per square kilometer has been ranked seventh in the list."
524,The Union Cabinet has approved 2.5% of the Central Road Fund (CRF) for the development of the National ___________.,Infrastucture,Borders and Coast lines,Waterways,Highways,C,45,The Union Cabinet has given its approval for allocating 2.5% of CRF for the development of the National Waterways. It will provide around Rs 2000 crore annually for the development and maintenance of the National Waterways which in turn will boost inland water transport.
525,Whicne mobile network started satellite phone service through International Maritime Satellite Organisation?,BSNL,Airtel,Aircel,Vodafone,A,45,Bharat Sanchar Nigam Limited (BSNL) started satellite phone service through International Maritime Satellite Organisation (INMARSAT). It opened a new Indian GSPS gateway to enable satellite phone services through Inmarsat's fourth-generation constellation. The service will cover areas where no networks are present and are provided by INMARSAT which has 14 satellite.
526,India will declare ____ Yoga Parks across the country to promote the traditional practice.,50,75,90,100,D,45,"Indian government has plans to declare a hundred parks especially dedicated for yoga activities across the country to promote the traditional practice. Prime Minister Narendra Modi will participate in the main event of the International Day of Yoga (IDY) which will be held in Lucknow, on June 21. Around 150 countries are expected to participate in the mega event, with Indian Missions in those nations coordinating the activities."
527,Microsoft and this company have partnered to improve Bing search results when it comes to searching for doctors online.,Vaatsalya,Apollo,Practo,Fortis,C,45,"Practo and Microsoft have partnered to improve Bing search results when it comes to searching for doctors online. The healthcare platform claims that the ""collaboration will enable an easier and effective search for people looking for right medical advice""."
528,Who is appointed as the secretary of the Central Board of Secondary Education (CBSE) recently?,Rajbir Singh,K.K.Choudhury,Anurag Tripathy,Joseph Emmanuel,C,45,"Senior bureaucrat Anurag Tripathy was appointed as the secretary of the Central Board of Secondary Education (CBSE). Tripathy, a 1998 batch officer of Indian Railway personnel Service (IRPS), has been appointed to the post for a period of five years, an order issued by Department of Personnel and Training (DoPT)."
529,"Before Sindhu, In India Who is the Elected Member of Badminton World Federation Athletes Commission?",Ashwini Ponnapppa,Chetan Anand,Syed Modi,Saina Nehwal,D,45,"Olympic silver medallist P V Sindhu became one of the members of the Badminton World Federation (BWF). Before Sindhu, Saina Nehwal was formal to a post to the commission."
530,Who is the elected as the Member of Badminton World Federation Athletes Commission?,PV Sindhu,Viktor AXELSEN,Chen Long,Carolina Martin,A,45,"Olympic silver medallist PV Sindhu became one of the members of the BWF Athletes' Commission after the end of voting for the four places on the representative body. Apart from Sindhu, Kirsty Gilmour of Scotland was placed third overall with 103 votes and Lithuania's Akvile Stapusaityte (25 votes) was the third woman elected to the Commission."
531,Which app is launched in National Museum by the Minister of State for culture &amp; Tourism Dr. Mahesh Sharma?,MEAIndia,Swachh Bharat App,GARV Grameen Vidyutikaran,Khoya Paya App,B,45,Swachh Bharat App launched in National Museum under Ministry of culture by the Minister of State for culture &amp; Tourism Dr. Mahesh Sharma. This will enable visitors to report garbage on the premises of the Archaeological Survey of India (ASI) monuments across the country.
532,Who is elected as the Ecuador President recently?,James Williams,Alfredo Palacio,Lenin Moreno,Gustavo Noboa,C,45,Lenin Moreno elected as President of Ecuador in Ecuador Presidential Elections 2017. He taken office and promised more subsidies for the poor and a major social house-building programme which would create millions of jobs.
533,India's first underwater tunnel connect which two cities?,Birbhum and Kolkata,Jhargram and Kolkata,Hooghly and Kolkata,Howrah and Kolkata,D,45,"Afcons Transtonnelstroy and Kolkata Metro Railway Corporation Limited (KMCRL) implemented the India's first underwater tunnel under the Hooghly river to link Howrah and Kolkata. The total length of the entire metro project is 16.6 km long, out of which 10.8 km runs under the ground. Of this 10.8 km, 502 metres is under the water. The total project cost is USD 750 million."
534,Which Union minister Inaugurates the Integration of eSanad with CBSE's Academic Repository recently?,Shri Nitin Gadkari,Shri Suresh Prabhu,Smt Sushma Swaraj,Smt Smriti Irani,C,45,"External Affairs Minister Sushma Swaraj, Human Resource Department Minister Prakash Javadekar and IT Minister Ravi Shankar Prasad jointly inaugurated the integration of E-Sanad with Central Board Secondary Education's (CBSE) digital repository 'Parinam Manjusha' in New Delhi. It is an e-service for online verification and attestation of documents of Indian citizens. It is ntegrated with Non- Tax Receipt Portal (NTRP) for enabling cashless payment."
535,Which is the host country of 2017 North Atlantic Treaty Organization (NATO)?,Romania,Belgium,Italy,Latvia,B,45,"Belgium is the host country of 28th edition of North Atlantic Treaty Organization (NATO) summit on May 24 and 25, 2017 in which terrorism will top the agenda of the meeting. It is expected that NATO is to join the US-led anti-Islamic State coalition(IS) to fight against Islamist terrorism."
536,The 70th edition of World Health Assembly (WHA70) has started in ____________.,Brussels,New Delhi,Paris,Geneva,D,45,"The 70th edition of World Health Assembly (WHA70) has started in Geneva, Switzerland on May 22, 2017 and ends on May 31, 2017. In it, Dr Tedros Adhanom Ghebreyesus of Ethiopia has elected a new Director-General of World Health Organization (WHO). He will succeed Dr. Margaret Chan and will take office for a five-year term on July 1, 2017."
537,Which country has ratify the International Solar Alliance (ISA) framework?,Grenada,Nauru,Malta,Maldives,B,45,"Nauru, the world's smallest republic, has become the sixth country to ratify the International Solar Alliance (ISA) Framework pact initiated by the Indian and French Governments at the climate change summit held at Paris in 2015. The motivating factor behind the ISA is the need for continents like Asia and Africa to protect the environment while generating energy for development goals."
538,Which is the first Asian country to recognize same sex marriage?,Taiwan,Lebanon,Timor-Leste,Jordan,A,45,"Taiwan has become the first Asian country to recognize same sex marriage after the constitutional court's ruling comes in support of legalizing same-sex marriage. The panel of judges has given the island's parliament, known as the Legislative Yuan, two years to amend or enact new laws, which could potentially make Taiwan the first place in Asia to allow same-sex marriage. The island has a large gay community and its annual gay pride parade is the biggest in Asia."
539,India and this country signed an MoU on cooperation in the field of Organ Transplant Services.,Russia,Spain,Singapore,Mexico,B,45,"Prime Minister Shri Narendra Modi approved the signing of a Memorandum of Understanding (MoU) between the National Transplant Organization, Ministry of Health, Social Services and Equality, Spain and the Directorate General of Health Services, Ministry of Health and Family Welfare, India on cooperation in the field of Organ Transplant Services. The MoU would facilitate bilateral cooperation in the field of organ and tissue procurement and transplantation and better understanding between the two countries."
540,Which bank launched a national Hackathon for developers and students to come up with innovative ideas for the banking sector?,ICICI,HDFC,SBI,Axis,C,45,"State Bank of India launched a national Hackathon for developers, start -ups and students to come up with innovative ideas and solutions for the banking sector. The hackathon has named 'Code For Bank'. The main aim to launch National hackathon is to come up with innovative ideas and solutions for the banking sector. It will start from June 6 and ends on June 20."
541,Which organisation won the Porter Prize 2017 for Excellence in Corporate Governance and Integration?,Whirlpool,Caterpillar,Intel,ITC,D,45,"ITC wins prestigious Porter Prize 2017 in two categories 'Excellence in Corporate Governance and Integration', 'Creating Shared Value'."
542,Who has been appointed as the new chairman of Internet and Mobile Association of India (IAMAI)?,Rajan Anandan,Sanjay Kumar Jha,Shantanu Narayen,Dinesh Paliwal,A,45,"Google's vice-president for South East Asia and India, Rajan Anandan has been appointed as the new chairman of Internet and Mobile Association of India (IAMAI). He replaces Kunal Shah FreeCharge's co-founder and chief executive officer."
543,Which company will host the Asian Junior Tennis Championship 2017?,Accenture,HCL,IBM,Microsoft,B,45,"Hindustan Computers Limited (HCL) to host the HCL Asian Junior Tennis Championship 2017, the most reputed tennis championship in the Asia. Different players from 11 countries - Thailand, Taiwan, Japan, South Korea, Philippines, Hong-Kong, Malaysia, China, Sri Lanka, Iran, and India are participating in the Championship."
544,Who inaugurated the Dhola-Sadiya bridge recently?,Shri Narendra Modi,Shri Naveen Patnaik,Shri Kadri Gopalnath,Shri Suresh Prabhu,A,45,Prime Minister Narendra Modi will inaugurate India's longest river bridge - the Dhola-Sadia Bridge across river Lohit at the easternmost tip of Assam. The construction of the bridge began in 2011 with the worth Rs 950 crore.
545,Who is the first amputee to swim across Red Sea's Gulf of Aqaba?,Michael Phelps,Adam Peaty,Michael Jackson,Omar Hegazy,D,45,"Egyptian swimmer Omar Hegazy became the first amputee to swim across Red Sea's 20 kilometers Aqaba Gulf from Egypt to Jordan, crossing a 20-kilometre (12.4 miles) stretch of the Red Sea's Gulf of Aqaba last month in under nine hours."
546,Who becomes the second Indian Judge to US Circuit Court of Appeals?,Shri Narayana Swamy,Rupen R. Shah,Sri Srinivasan,Amul Thapar,D,45,The United States Senate confirmed Indian-American Judge Amul Thapar to a key judicial position on the powerful US court of appeals. He has become the second Indian-American judge of an appeals court.
547,Which ministry bans the cattle slaughter Across India?,Ministry of Environment,Ministry of Civil Aviation,Ministry of Human Resource Development,Ministry of agriculture and Farmer welfare,A,45,"The Environment Ministry banned cattle slaughter and introduced restrictions on the sale of cattle to prevent their killing. Animal markets cannot be set up within 50 km of an international border and 25 km from a state border. All animal markets have to run with the approval of district animal market committee to be headed by a magistrate. A gazette notification, titled Prevention of Cruelty to Animals (Regulation of Livestock Markets) Rules, 2017 by the Ministry of Environment, Forests and Climate Change states that no one can bring cattle to an animal."
548,Bharat Heavy Electricals Limited (BHEL) commissioned a ________ thermal unit in Maharashtra.,150-megawatt,270-megawatt,250-megawatt,170-megawatt,B,45,"Bharat Heavy Electricals Limited (BHEL) commissioned a 270-megawatt (MW) thermal unit in Maharashtra. The project is owned by Maharashtra State Power Generation Company (Mahagenco). It has commissioned 16,000 MW of power generation capacity in Maharashtra."
549,Who launched the deadly encephalitis vaccination drive in 38 districts?,Arvind Kejriwal,N. Chandrababu Naidu,Yogi Adityanath,Pinarayi Vijayan,C,45,Uttar Pradesh Chief Minister Yogi Adityanath has launched a campaign to eradicate the deadly encephalitis disease that claims the lives of hundreds of children every year in the state. The government also launched a toll free number to get or provide any information about encephalitis. The number is 18001805544. His several cabinet colleagues also participated in the launch programmes in different districts. Government has fixed the target of immunisation of above 88 lakh 55 thousand children in the age group of 1 to 15 during the drive in the 38 districts.
550,"For which bank, the Reserve Bank of India allows mobile wallet?",Regional Rural Banks,Cooperative Banks,Foreign banks,None of the Above,B,45,"Reserve Bank of India decided to permit all licensed cooperative banks having their own ATM network to issue semi-closed prepaid payment instruments (PPI)s like mobile wallets. This enlists strict norms and conditions to be followed by cooperative banks before permitting them to issue wallets for utility bill payments and other activities up to a limit of Rs 10,000."
551,"Which state CM presented a tax-free budget of Rs. 6,945 crore for 2017-18?",Kerala,Puducherry,Tamilnadu,Andra Pradesh,B,45,"Puducherry Chief Minister V. Narayanasamy presented a tax-free budget of Rs. 6,945 crore for 2017-18. The contribution from own resources was estimated to be Rs. 4,022 crore. The government decided to bear the expenditure towards farmer's share of the insurance premium under the 'Pradhan Mantri Fasal Bima Yojan'. And also proposed to provide insurance cover for both Samba and Navarai crops covering 12,500 hectares."
552,Which Indian state to host 2017 Asian Junior Tennis Championship?,Maharashtra,Gujarat,Haryana,West Bengal,A,45,"Global conglomerate HCL will host the HCL Asian Junior Tennis Championship 2017, the most reputed tennis championship in the Asian circuit for the U/18 category in association with the Maharashtra State Lawn tennis Association, from May 29. It will take place from May 29 to June 03, 2017 at MSLTA school of tennis courts at the Shri Shiv Chhatrapati Sports Complex, Balewadi in Pune. Players from 11 countries in the region (Thailand, Taiwan, Japan, South Korea, Philippines, Hong-Kong, Malaysia, China, Sri Lanka, Iran and India) are participating in the Championship."
553,Which company is the highest ranked Indian firm in Forbes magazine's 'Global 2000' list?,Hindustan Unilever,Imperial Tobacco Company (ITC),Oil and Natural Gas Corporation (ONGC),Reliance Industries Limited (RIL),D,45,"Mukesh Ambani-led Reliance Industries (RIL) is the highest ranked Indian firm in Forbes magazine's 'Global 2000' list this year which sees the number of Indian companies in 2017 rising to 58 from last year's 56. Reliance Industries is followed by State Bank of India, the country's largest lender,ranked 244 this year (149 last year), and state-run oil explorer ONGC ranked 246 (220 last year)."
554,"Which is the world's most crowded cities, according to World Economic Forum (WEF) citing UN Habitat Data?",Medellin,Dhaka,Manila,Guttenberg,B,45,"With a population density of 44,500 people per square kilometer, Dhaka, the capital of Bangladesh, is the most crowded city. India's financial capital Mumbai, home to 31,700 people per square kilometre at the second place. Kota in Rajasthan with 12,100 people per square kilometre was ranked seventh."
555,Which country hosting the 2017 World Street Food Congress (WSFC17)?,Bangladesh,Chile,Philippines,Germany,C,45,"Philippines hosting the 2017 World Street Food Congress for the 2nd time. The WSFC17's theme is ""Re-imagine Possibilities"" and it aims to open people's minds, eyes, and palates and create a bigger appetite for heritage street food opportunities around the world."
556,Which country retained as the world's top most greenfield FDI investment destination?,India,Afghanistan,France,Ireland,A,45,"India retained its numero uno position being the world's top most greenfield FDI investment destination for the second consecutive year, attracting USD 62.3 billion in 2016. India has remained ahead of China and the US as far as FDI inflows were concerned in the last year, said the fDi Report 2017 compiled by fDi Intelligence, a division of The Financial Times Ltd. FDI by capital investment saw an increase of 2 per cent to USD 62.3 billion in 809 projects during 2016 in India."
557,Which Indian company is placed in the top 10 consumer financial services companies in the world?,Bank Of India,City Union Bank,Federal Bank,HDFC Bank,D,45,"HDFC Ltd is the only Indian company to be named among the top 10 consumer financial services companies in the world. It is placed with profits of $1.6 billion and sales of $8.1 billion HDFC was ranked seventh on the Forbes Global List 2017 in the consumer financial services sector same as last year. American Express topped the list, followed by Capital One Financial and Visa in the second and third place."
558,Who received the first copy of Prime Minister Narendra Modi's 'Mann Ki Baat'?,Arun Jaitley,Pranab Mukherjee,Sushma Swaraj,Venkaiah Naidu,B,45,"The first copy of Prime Minister Narendra Modi's 'Mann Ki Baat' a book titled 'Mann Ki Baat - A Social Revolution on Radio' was received by President Pranab Mukherjee. On the occasion of the third anniversary of the Narendra Modi government, the book was launched by Lok Sabha Speaker Sumitra Mahajan. The book is a compilation of Prime Minister Shri Narendra Modi's addresses to the nation on radio every month under the programme 'Mann Ki Baat'."
559,"Which Indian monument was featured in the list of top 10 Global Landmarks, by Traveller's Choice?",Taj Mahal,Meenakshi Amman Temple,India Gate,Mysore Palace,A,45,"Taj Mahal, one of the most iconic wonders in the world, the Agra- based imposing white marble structure, a tourist delight, is the only Indian monument to figure in the world's top 10 Travellers' Choice awards for Landmarks. Angkor Wat in Siem Reap (Cambodia) topped the list followed by Sheikh Zayed Grand Mosque Center in Abu Dhabi (UAE), Mezquita Cathedral de Cordoba in Cordoba (Spain) and St Peter's Basilica in Vatican City (Italy). According to the Asia list, Taj Mahal was at No. 2 spot after Angkor Wat."
560,Who lays a foundation stone for AIIMS at Changsari?,Rajnath Singh,Manohar Parrikar,Jagat Prakash Nadda,Narendra Modi,D,45,"Prime Minister Narendra Modi laid the foundation stone of All India Institute of Medical Sciences (AIIMS), Guwahati to be set up at Changsari in Assam. The institute will be constructed at a cost of Rs 1,123 crores as part of the 'Pradhan Mantri Swasthya Suraksha Yojana'."
561,NASA's Juno Spacecraft has discovered Earth-sized cyclones at this planet.,Saturn,Mercury,Pluto,Jupiter,D,45,National Aeronautics and Space Administration (NASA's) Juno spacecraft has discovered Earth-sized cyclones at the poles of the Jupiter. It showed the presence of the storm systems that travel deep into the heart of the planet. Measurements of Jupiter's magnetosphere indicate that Jupiter has a stronger magnetic field than expected which is more irregular in shape. The magnetic field on the planet is in the order of 7.766 Gauss which is about 10 times stronger than the strongest magnetic field found on Earth.
562,Apple recently opened its first store in ___________.,Paris,London,Singapore,Moscow,C,45,Apple opened its first Southeast Asia store in Singapore to operate fully on solar power. Merchandise such as the iPhone and MacBook were strategically placed on display. It is Located along Singapore's Orchard Road shopping strip with 237 employees.
563,What is the name of the E-vehicle company which is inaugurated at Nagpur?,UBER,OLA,FASTTRACK,INDIA Cabs,B,45,"The name of the E-vehicle company is OLA. Maharashtra chief minister Devendra Fadnavis inaugurated India's first multi-modal electric vehicle project and Ola electric charging station in Nagpur. Nagpur became the country's first city with electric fleet of 200 electric vehicles, including taxis,buses, e-rickshaw and autos."
564,Which university honoured the Mark Zuckerberg with doctorate degree?,Harvard University,University of Cambridge,National University of Singapore,University of Oxford,A,45,Harvard University honoured the Mark Zuckerberg with doctorate degree. He dropped out of the Ivy League school to focus on Facebook. He started Facebook in his Harvard dorm room in 2004.
565,This hill station won the award for 'Best Destination for Romance' at the Lonely Planet Magazine Indian Travel Awards 2017.,Munnar,Thekkady,Vagamon,Ayyampuzha,A,45,"Kerala Tourism received the award as the 'Best Destination for Romance' for Munnar by Lonely Planet Magazine India Travel Award 2017. The hilly Munnar town in Idukki district is famous for its romantic cottages, cloudy mountains, lively tea gardens, green valleys, waterfalls. P Bala Kiran, Director of Kerala Tourism received the award."
566,"Which institute student developed a wearable technology wristband which has significant potential to recognise changes in human emotions, the brain, and human behaviour?","Visvesvaraya National Institute of Technology,","National Institute of Technology, Calicut.",Motilal Nehru National Institute of Technology,Massachusetts Institute of Technology,D,45,"The wristwatch-like wearable technology was developed by an MIT engineer. It has a significant potential to recognise changes in human emotions, the brain, and human behaviour. The wristband has an automated machine learning method. It can detect compulsive seizures by combining measures of electrodermal activity on the wrist with measures of motion through a response to sweat."
567,On which date the Africa Day is celebrated?,May 25th,May 26th,May 27th,May 28th,A,45,"Africa Day is celebrated on May 25 to commemorate the founding of the Organisation of African Unity (OAU). Africa is the second largest continent in the world, it is ""non-self governing territory"" and home to 54 countries."
