id,Question,optionA,optionB,optionC,optionD,correct_option,Time,Explanation
1529,Mohammad Mustafa was appointed as Chairman and Manging Director of __________.,IRBI,IDBI,SIDBI,IFCI,C,45,Senior bureaucrat Mohammad Mustafa was appointed as Chairman and Manging Director in Small Industries Development Bank of India (SIDBI). The Appointments Committee of the cabinet has approved his appointment to the post for three years.
1530,Microsoft joint hands with this state to provide AI-based eye care solutions.,Bihar,Kerala,Andra Pradesh,Telangana,D,45,Microsoft is going to help the government of Telangana use artificial intelligence to provide eye care screening for children in the State. Microsoft's cloud based machine learning eye care screening Microsoft Intelligent Network for Eyecare (MINE) will align with the Rashtriya Bal Swasthya Karyakram programme under the National Health Mission.
1531,Who among the following is the Highest Paid Author according to Forbes?,Jeff Kinney,JK Rowling,Dan Brown,James Patterson,B,45,"Harry Potter creator JK Rowling has been named the world's most highly-paid author with earnings of &pound;72.2m ($95m) this year. The Edinburgh-based writer beat Dan Brown, Stephen King and John Grisham to top Forbes' list of the 10 highest earners in the global industry for the first time in almost 10 years."
1532,In Which city India's first private missile production facility unveiled?,Hyderabad,Bengaluru,Patna,Chennai,A,45,"India's first private sector missile sub-systems manufacturing facility, a joint venture between the $2.5 billion Kalyani Group and Israel's Rafael Advanced Defence Systems Ltd., was inaugurated near Hyderabad. It is formed in line with the 'Make in India' initiative of the Centre and the policy to encourage private sector participation in defence production, the 51:49 joint venture will develop a wide range of advanced capabilities."
1533,The union government planned to develop the Green Airports in __________.,Kerala,Andhra Pradesh,Tamil Nadu,Bihar,B,45,"Union Government launched green airports, two airports in Andhra Pradesh. Airport Authority of India (AAI) commenced installation of the 1MegaWatt solar power plant at Tirupathi and Vijayawada Airports. The basic capacity of installed solar power plants at 29 airports/locations with a total capacity of 12.84 MWp."
1534,"Which Bank is featured in the new Exchange Trade Fund, Bharat 2022?",Bank of Baroda,Bank of India,HDFC,Karur Vsya Bank,A,45,"inance Minister Arun Jaitley announced creation of new Exchange Trade Fund called Bharat 2022, comprising of 22 companies, or investments from central public sector undertakings, public sector banks and some other strategic holdings. It will feature four banking stocks -- SBI, Axis Bank, Bank of Baroda and Indian Bank -- other than CPSEs such as Nalco, ONGC, IOC, BPCL and Coal India."
1535,Which of the following received the government's nod for foreign direct investment to undertake retailing of food products recently?,Nature's Basket,Reliance Fresh,BigBasket,Bazaar Cart,C,45,"After Grofers and Amazon India, online grocery firm BigBasket on Wednesday received the government's nod for foreign direct investment to undertake retailing of food products, which are manufactured or produced in India."
1536,With Which company Indian Railways signs first EPC contract recently?,Larsen and Toubro,Mahindra,Ashok Leyland,TATA,A,45,"The Indian Railways signed its first EPC (Engineering, Procurement, Construction) contract with Larsen and Turbo (L&amp;T) for electrification of railways. The contract valuing Rs 1,050 crore was awarded by Central Organisation for Railway Electrification (CORE) and Konkan Railways."
1537,Aadhaar number will be mandatory for the registration of death from?,"October 1, 2017","November 1, 2017","December 1, 2017","January 1, 2018",A,45,"The government made Aadhaar numbers a pre-requisite for issuing death certificates to residents of all States, barring Jammu &amp;amp; Kashmir, Meghalaya and Assam, in order to establish the identity of the deceased. he Registrar General India (RGI), in a notification, stated that the Aadhaar-linked death registration will start from October 1, 2017."
1538,Which country has recently appointed Paul Kagame as its president?,Russia,Tunisa,Nigeria,Rwanda,D,45,"Rwanda's President, who has ruled the tiny African nation for 17 years, won the country's latest election with a massive landslide. With 80 per cent of ballots counted, Paul Kagame looked set to secure 98.66 per cent of the vote, easily brushing aside his rivals Frank Habineza of the Democratic Green Party of Rwanda, who took just 0.45 per cent, and independent candidate Phillippe Mpayimana, who took 0.72 per cent."
1539,Who has been confirmed as a member of the Federal Energy Regulatory Commission in the Trump administration?,Neil Chatterjee,Vishal Amin,Krishna Urs,Nikki Haley,A,45,"In the United States, the Senate has unanimously confirmed three Indian-Americans to key government positions. The Senate confirmed Neil Chatterjee as a member of the Federal Energy Regulatory Commission and Vishal Amin as Intellectual Property (IP) Enforcement Coordinator in the Trump administration. Krishna Urs was confirmed as the US ambassador to Peru."
1540,Who has been appointed as the chairman of a special committee that will be dealing with players transfer disputes?,Kishore Taid,Ushanath Banerjee,Kushal Das,Shyam Thapa,B,45,The AIFF has appointed senior advocate Ushanath Banerjee as the chairman of a special committee. It will deal with the players 'transfer disputes'. The Committee assigned the task to make a detailed and reasoned paper based on the review of the rules and regulations for consideration of the members for a decision thereafter.
1541,Who among the following veteran actress has been selected for this year's Prem Nazir Award?,Laxmi,Smitha,Sharada,Priya,C,45,Veteran actor and national award winner Sharada has been selected for this year's Prem Nazir Award. Sharada had won three national awards with the first being for her performance in 1968 tragedy film 'Thulabharam'.
1542,CSIR-NPL and this organisation sign MoU for time and frequency traceability services.,National Institute of Technology,Anna university,Nagaland University,The Indian Space Research Organization (ISRO),D,45,The Indian Space Research Organization (ISRO)Telemetry Tracking and Command Network (ISTRAC) and CSIR-National Physical Laboratory (NPL) signed Memorandum of understanding(MOU) to make indigenous regional position. It will help the NAVIC to get formally synchronized with the Indian Standard Time (IST) which is being maintained by the Delhi-based NPL company.
1543,With Whom India signed a loan Agreement for Financing of US$ 329 million for Gujarat Rural Roads Project?,ABN AMRO,Standard Chartered,Federal bank,Asian Infrastructure Investment Bank,D,45,"The Government of India/ Government of Gujarat signed US$ 329 million Loan and Project Agreements with Asian Infrastructure Investment Bank (AIIB) for or Gujarat Rural Roads Project. The objective of Gujarat Rural Roads Project is to improve the rural road connectivity and accessibility by providing all weather road connectivity to 1,060 villages in all the 33 districts in Gujarat."
1544,The Lok Sabha passed a Bill for establishing the Indian Institute of Petroleum and Energy (IIPE) in which state?,Kerala,Andhra Pradesh,Tamil Nadu,Bihar,B,45,The Lok Sabha passed a Bill for establishing the Indian Institute of Petroleum and Energy (IIPE) in Andhra Pradesh that will impart high quality education and conduct advance research in all aspect relating to the conventional hydrocarbons.
1545,Which bank cuts interest rate on savings bank balance of up to Rs 50 lakh has been reduced to 3.5 per cent from the current annual 4 per cent?,Axis Bank,Dena Bank,Bank of Baroda,Punjab National Bank,C,45,"After SBI, the Bank of Baroda cuts interest rate on savings bank balance of up to Rs 50 lakh has been reduced to 3.5 per cent from the current annual 4 per cent. However, for balance above of Rs 50 lakh, the bank has retained the rate at 4 per cent. However, for balance above of Rs 50 lakh, the bank has retained the rate at 4 percent."
1546,The First Meeting of Japan-India Coordination Forum was held in _________.,New Delhi,Patna,Chennai,Bengaluru,A,45,"The first meeting of the Japan-India Coordination Forum (JICF) for Development of North-Eastern Region was held in New Delhi. The areas of cooperation identified by Indian side including Connectivity and Road Network Development, especially inter-State roads &amp; major district roads; Disaster Management; Food Processing; Organic Farming and Tourism were discussed in the meeting."
1547,Who has will be the new Vice-Chairman of NITI Aayog?,Rajiv Kumar,Vinod Paul,Ritesh Gupta,S L Shivappa,A,45,"Economist Dr. Rajiv Kumar will be the new Vice-Chairman of NITI Aayog, which is a think-tank that replaced the Planning Commission. He will succeed Arvind Panagariya, who will leave the government think tank on August 31, 2017 and return to Columbia University. Currently, Rajiv Kumar is a senior fellow at the Centre for Policy Research, a non-governmental think tank on public policy based out of New Delhi."
1548,This country will host the 15th meeting of the Foreign Ministers of BIMSTEC countries?,India,Bhutan,Indonesia,Nepal,D,45,"The 15th meeting of the Foreign Ministers of BIMSTEC countries will be held in Kathmandu, Nepal from August 10-11, 2017. From India, the Union External Affairs Minister Sushma Swaraj will represent India in the meeting and will hold bilateral meetings with the leaders of the members countries. During the BIMSTEC meeting, progress on several programmes will be discussed."
1549,Which railway station has been renamed as Deen Dayal Upadhyaya recently?,Malihabad,Mughalsarai,Manoharganj,Mihinpurwa,B,45,"The centre approved a proposal to rename the Mughalsarai railway station in Uttar Pradesh after RSS ideologue Deen Dayal Upadhyaya. The proposal was given by the BJP government in Uttar Pradesh in a bid to revive the legacy of Upadhyaya, who died in 1968 at the junction itself."
1550,The National Handloom Day is observed on __________.,Aug 7th,Aug 9th,Aug 6th,Aug 5th,A,45,The National Handloom Day is being observed on 7 August every year to honor the handloom weavers in the country. Handloom sector contributes to nearly 15% of the cloth production in the country and also contributes to the country's export earnings to 95%.
1551,Which researchers develops new nanotechnology-based drug delivery system?,"Indian Institute of Technology , Chennai","Indian Institute of Technology, Delhi",Nagaland university,Kerala University,B,45,An all-women team of researchers from Indian Institute of Technology (IIT) Delhi developed a new drug delivery platform using nanoparticles. The nanotechnology-based drug delivery system has the ability to boost the efficacy of antibiotics at the cellular level and improve chances of recovery.
1552,"Which researchers develop low-cost, sensitive CO sensor?",World Agroforestry Center,World Zoological Center,Indian Institute of Science (IISc),International Centre for Research in Agroforestry,C,45,"Indian Institute of Science (IISc) researchers from Bengaluru have developed a highly sensitive, low-cost nanometre-scale carbon monoxide (CO) sensor. The nanometer-sized sensor was made using zinc-oxide (ZnO) nanostructure on a silicon wafer substrate."
1553,Who is appointed as the new Vice President of India?,Shri Ramesh Kumar,Shri Naveen Patnaik,Shri Venkaiah Naidu,Shri Arun Jaitley,C,45,"NDA nominee M Venkaiah Naidu was on Saturday elected as the next vice-president of India by securing over two-thirds of votes, leaving opposition candidate Gopalkrishna Gandhi far behind. Naidu got 516 votes out of total 771 votes cast while Gandhi could only manage 244 votes. Of the 771 votes polled, 11 were invalid. Although 785 MPs are there in both Houses of Parliament, 14 MPs could not vote."
1554,The Tele-Law scheme was launched in _________.,Goa,Bihar,Assam,Odisha,B,45,"The Centre in association with the National Legal Service Authority (NALSA) launched 'Tele-Law' scheme in Bihar with an aim to provide an opportunity for the common man to access legal aid easily. Under the scheme, villagers can have access to legal consultation with the help of para legal volunteers at Common Service Centre (CSC) which will be equipped with computers and Internet facility."
1555,The global information technology (IT) delivery centre is coming up in which of the following place?,Pune,Mumbai,Jaipur,Kochi,C,45,"A global information technology (IT) delivery centre is coming up in jaipur to provide the ease of doing business to the engineering, architectural and professional companies in their international operations.It has been specially designed to cater to the changing dynamics of the business world. It is set up with an investment of Rs.100 crore, is expected to give employment to about 1,100 engineers, architects and IT and other professionals."
1556,Who is appointed as Executive Director of World Bank?,Smt. S.Aparna,Shri Suresh Misra,Shri Rajesh Sharma,Shri Vignesh Kumar,A,45,"S. Aparna, an IAS officer from Gujarat cadre has been appointed as Executive Director, World Bank to represent the constituency of India, Bangladesh, Bhutan and Sri Lanka for three years. She is currently Principal Secretary to Gujarat Chief Minister Vijay Rupani."
1557,Who is the Brand Ambassador for Swachh Bharat Mission in Uttar Pradesh?,Rajesh Sharma,Suresh Kumar,Naveen Kumar,Akshay Kumar,D,45,Uttar Pradesh Chief Minister Yogi Adityanath announced the appointment of Bollywood actor Akshay Kumar as the brand ambassador of the Swachh Bharat Mission in the state.
1558,Which company joins with Bajaj Finance for Larger Financial Services Pie?,Paytm,Airtel Payment,MobiKwik,Freecharge,C,45,"Taking a big step towards positioning itself as a top consumer finance brand in the digital space, mobile wallet major MobiKwik has entered into a strategic partnership with Bajaj Finance Ltd to transform itself into financial services App from a payment App. Under this strategic partnership, Bajaj Finance has picked up 10.83 per cent equity stake in MobiKwik for about Rs. 225 crore and offer its lending (purchase finance, credit card, mortgage loans and personal loans) and insurance products to be sold through MobiKwik App."
1559,Who won the Citi Open title recently?,Andy Murray,Rafael Nadal,Alexander Zverev,John Williams,C,45,"Alexander Zverev of Germany won Citi Open fourth title of the year recently. He defeated South Africa's, Kevin Anderson. The past champions whose names line the grandstands at the Citi Open include Andre Agassi (five times), Jimmy Connors, Stefan Edberg and Ivan Lendl."
1560,Which state government is all set to distribute 13 lakh Soil Health Cards among farmers?,Bihar,Rajasthan,Punjab,Assam,D,45,"The Assam government is all set to distribute 13 lakh Soil Health Cards among farmers. Under the scheme, the government plans to issue soil cards to farmers which will carry crop-wise recommendations of nutrients and fertilisers required for the individual farms to help farmers to improve productivity through judicious use of inputs. And Rs.7.54 crore has been released as subsidy to farmers under crop insurance."
1561,Who Won the Women Citi Open in Washington DC held recently?,Julia Goerges,Ekaterina Makarova,Jelena Jankovic,Annika Beck,B,45,Russian Ekaterina Makarova turned on the marathon magic again to defeat Julia Goerges and win the Citi Open in Washington DC. She came from a set behind for the third successive time to claim her first WTA title in more than three years.
1562,Mastercard and __________ have extended their partnership into Asia Pacific to enhance the consumer experience.,Google Wallet,PayPal,Braintree,WePay,B,45,"Mastercard and PayPal have extended their partnership into Asia Pacific to enhance the consumer experience and make Mastercard a clear payment option with PayPal. The deal will expand PayPal's presence at the point of sale and enable Masterpass for Braintree merchants in the region. Additionally,both companies will collaborate to create opportunities to leverage Mastercard's new payment flow technologies."
1563,Which state plan to spend Rs 1 lakh crore on development works on education and road connectivity?,Punjab,Gujarat,Bihar,Jammu &amp; Kashmir,D,45,"The Jammu and Kashmir government would spend Rs 1 lakh crore on development works in the next five years, with special emphasis on education and road connectivity."
1564,"August 15, 2017 Independence Day of India will be celebrated as?",Prarthna Divas,Saksharta Divas,Sankalp Divas,Prekshan Divas,C,45,"The government has decided to observe this Independence Day as 'Sankalp Parva' and asked the people to dedicate themselves to social causes and share their ideas to make a new India. Terming 'Quit India Movement' as an important milestone, the government has asked people to take a pledge to create a new India that is strong, prosperous and inclusive."
1565,On which city the first marine mammal rescue centre is opened recently?,Mumbai,Hyderabad,Patna,Jaipur,A,45,"The dolphins, whales, tortoises and turtles that wash ashore Mumbai's beaches injured will soon get medical aid at the city's first marine mammal rescue centre. It is Proposed at Juhu beach, the centre is part of the government's plan to invest Rs1 crore to build rescue centres in every district along Maharashtra's 720-km coastline."
1566,Which car company signed a deal with the country Iran?,Renault Nissan,Hyundai,Maruti Suzuki,Ford,A,45,"Iran signed the country's biggest-ever car deal with French multinational automobile manufacturer Group Renault to produce 150,000 cars, beginning in 2018. French carmaker PSA Peugeot Citroen reached a deal with Iran Khodro to open a plant producing 200,000 vehicles annually."
1567,Dawn of cruise tourism in India was inaugurated in __________.,New Delhi,Chennai,Patna,Mumbai,D,45,"The dawn of cruise tourism in India' was inaugurated in Mumbai. There is the launch of three reports, ""Mumbai Port SoP's for cruise operations"", ""Road map for Sea cruise tourism"" and ""Cruise terminals in India""."
1568,With which department did the Union Government merged with Police Research and Development (BPRD) recently?,National Crime Records Bureau (NCRB),Indian Police Service,National Security Guard,Indian Airforce Service,A,45,Union Home Ministry passed an order to merge the three-decade old National Crime Records Bureau (NCRB) with Bureau of Police Research and Development (BPRD). It have an aim to improve administrative efficiency and optimal utilization of resources.
1569,"This banks customers will have to pay charges for depositing cash above Rs 5,000 in a non-base branch.",Dena Bank,Union Bank,Punjab National Bank,Lakshmi Vilas Bank,C,45,"PNB customers will have to pay charges for depositing cash above Rs 5,000 in a non-base branch even if it is located in the same city. Currently, the customers of Punjab National Bank (PNB) are levied charges only for depositing cash over Rs 25,000 at a non-base branch within the same city. It has been decided to revise the non-credit related charges (exclusive of GST) with effect from September 1, 2017 for cash deposit above Rs 5,000 at other than base branch within the same city."
1570,The government of India launched the second phase of measles-rubella (MR) vaccination campaign in the country for how many states?,7,5,10,8,D,45,"Aiming to eliminate measles and curb instances of rubella by 2020, the Centre has rolled out the second phase of its measles-rubella (MR) vaccination campaign in the country. Nearly 3.4 crore children across eight states and union territories - Andhra Pradesh, Chandigarh, Himachal Pradesh, Kerala, Telangana, Uttarakhand, Dadra and Nagar Haveli and Daman and Diu - will be covered in this stage."
1571,Who won the Gold Medal in Asian Shotgun Championship?,Ankur Mittal,Sekar Rajan,Suresh Rajesh,Vijay Kumar,A,45,"Indian shooter Ankur Mittal clinched the individual as well as the team gold medal in men's double trap at the 7th Asian Shotgun Championship in Astana, Kazakhstan. UAEs KhaledAlkaabi (70) won the silver in men's double trap event and SaifAlshamsy (53) won the bronze."
1572,Who was honoured by UAE Government recently?,Anil Ambhani,Firoz Merchant,Ashok Misra,Rajesh Verma,B,45,"Firoz Merchant, an Indian businessman in the United Arab Emirates (UAE) spent over USD 4 million to help free prisoners languishing in jails due to non-payment of debts honored with UAE's prestigious Community Service Medal. The award is given in the form of a medal in recognition of his efforts to serve the community in the country."
1573,The World's Shortest Woman released the book of _________.,31 feet,51 feet,28 feet,41 feet,B,45,The world's shortest woman Jyoti Amge unveiled a 51-feet high book at a programme here. The book Kadve Vachan written by Jain saint Acharya Tarun Sagar Maharaj was unveiled by her in the presence of BJP state president Ashok Parnami. It is the ninth volume of the book written in Hindi. Amge is considered to be the world's shortest woman by the Guinness World Records at 62.8 cm.
1574,Iran and this country call for early operationalisation of Chabahar Port.,India,China,Pakistan,Africa,A,45,"India and Iran have expressed commitment for early completion and operationalisation of Chabahar Port besides strengthening bilateral ties. Both the countries in a series of meetings held during the Union Road Transport, Highways and Shipping Minister Nitin Gadkari two-day visit to Iran."
1575,FIBA Asia Cup is going to be held in which of the following country?,Syria,Liechtenstein,Maldives,Lebanon,D,45,"Asia's biggest basketball tournament, known as FIBA Asia Cup, will be held in Beirut, Lebanon. Indian men's team, led by Amjyot Singh Gill, will participate in the tournament in group A, starting their campaign against Iran followed by games against Jordan and Syria."
1576,"Recently, Who beaten Usain Bolt in 100m finals?",John Williams,Andy murray,Justin Gatlin,Mike Costollo,C,45,"Justin Gatlin won the 100 m gold with the run of his long run towards the 100-meter seconds. The 35-year-old Gatlin reached lane seven in 9.92 seconds, with Coleman's 9.94 holding off the greatest sprinter of all time."
1577,This country hosts the 8th edition of Global Entrepreneurship Summit (GES).,Turkey,India,United States,France,B,45,"The 8th edition of Global Entrepreneurship Summit (GES)-2017 will be hosted by India and is scheduled to be held on November 28, 2017. The NITI Aayog in association with the Ministry of External Affairs and the Andhra Pradesh government have been assigned with organising the event. The GES brings together investors and entrepreneurs from around the world to create new opportunities for collaboration. The summit will promote economic growth, inclusion and opportunities among entrepreneurs from across the world, with a special focus on emerging nations from Africa and Asia."
1578,Which team has won the 2017 All-India MCC-Murugappa Gold Cup hockey tournament?,Punjab National Bank (PNB),Bengaluru Hockey Association (BHA),Oil and Natural Gas Corporation (ONGC),Indian Oil Corporation (IOC),C,45,"The Oil and Natural Gas Corporation (ONGC) has won the 91st edition of All-India MCC-Murugappa Gold Cup hockey tournament by defeating Bengaluru Hockey Association (BHA) by 4-2 in the final at Mayor Radhakrishna stadium Egmore at Chennai, Tamil Nadu. Man of the match: Rajkumar Pal."
1579,Who has been appointed as the new Chief Justice of India (CJI)?,Ranganath Misra,K K Mittal,Dipak Misra,G B Pattanaik,C,45,"Justice Dipak Misra, the senior-most judge of the Supreme Court, has been appointed as the new Chief Justice of India (CJI) and will have a tenure of nearly 13 months. He will succeed Chief Justice J S Khehar, who will retire on August 27, 2017. Justice Misra is known for the judgment on Yakub Memon who made a last minute attempt to escape the gallows."
1580,Who signs an agreement with Rs 100 crore Deal with Startup Cure Fit recently?,Hrithik Roshan,Salman Khan,Ranveer Singh,Abhishek Bachchan,A,45,"Hrithik Roshan signed as a brand ambassador by a health and wellness startup Cure fit in a deal worth Rs 100 crore. The actor will be associated with the brand for five years. The deal also includes the actor's equity stake in the company in lieu of cash investment, promotions and royalty from his personal brand HRX's specialized workout plan."
1581,"The Centre has declared entire area of which state as a ""disturbed"" area under Armed Forces (Special Powers) Act (AFSPA)?",Jharkhand,Assam,Mizoram,Chhattisgarh,B,45,"The Centre has declared entire Assam as a ""disturbed"" area under the controversial Armed Forces (Special Powers) Act (AFSPA) for one more month, citing various violent activities by insurgent groups ULFA, NDFB, and others. The Union home ministry also declared Meghalaya's border areas adjoining Assam, and three districts in Arunachal Pradesh as ""disturbed"" under the AFSPA for two more months with effect from August 3, 2017."
1582,"The Legislative Assembly of this state passed a bill which reclassifies coconut as a `tree', ensuring legal protection for it.",Goa,Tamil Nadu,Kerala,West Bengal,A,45,"The Goa Legislative Assembly passed a bill which reclassifies coconut as a tree, ensuring legal protection for it. Goa Forward Party, a partner in the Manohar Parrikar-led government, had promised to reclassify coconut. The Assembly passed the Goa, Daman and Diu (Preservation of) Trees Act, 1984 to regulate felling of coconut trees and reclassify it as tree."
